------[ AIDA64 Extreme v5.00.3345 Beta ]------

------[ Microsoft Windows 8.1 Professional 6.3.9926.0 (64-bit) ]------

------[ Motherboard Info ]------

Motherboard ID      : 63-0100-000001-00101111-121412-Chipset$P650SA038_BIOS DATE: 12/15/14 17:32:18 VER: 04.06.05
Motherboard Model   : Hasee CP65S
Motherboard Chipset : Intel Lynx Point HM87, Intel Haswell

DMI MB Manufacturer : Hasee Computer
DMI MB Product      : CP65S
DMI MB Version      : Not Applicable
DMI MB Serial       : Not Applicable
DMI SYS Manufacturer: Hasee Computer
DMI SYS Product     : CP65S
DMI SYS Version     : Not Applicable
DMI SYS Serial      : Not Applicable
DMI BIOS Version    : 1.03.02

------[ PCI Devices ]------

B00-D00-F00 [8086-0C04] [1558-6557] [CC0600]: Intel Haswell-MB - Host Bridge/DRAM Controller
B00-D01-F00 [8086-0C01] [0000-0000] [CC0604]: Intel Haswell - PCI Express x16 Controller
B00-D02-F00 [8086-0416] [1558-6557] [CC0300]: Intel Haswell-MB GT2 - Integrated Graphics Controller
B00-D03-F00 [8086-0C0C] [1558-6557] [CC0403]: Intel Haswell - Mini HD Audio Controller
B00-D14-F00 [8086-8C31] [1558-6557] [CC0C03]: Intel Lynx Point PCH - USB 3.0 xHCI Host Controller [C-2]
B00-D16-F00 [8086-8C3A] [1558-6557] [CC0780]: Intel Lynx Point PCH - Host Embedded Controller Interface 1 (HECI1) [C-1]
B00-D1A-F00 [8086-8C2D] [1558-6557] [CC0C03]: Intel Lynx Point PCH - USB 2.0 EHCI Host Controller 2 [C-2]
B00-D1B-F00 [8086-8C20] [1558-6557] [CC0403]: Intel Lynx Point PCH - High Definition Audio Controller [C-2]
B00-D1C-F00 [8086-8C10] [0000-0000] [CC0604]: Intel Lynx Point PCH - PCI Express Root Port 1
B00-D1C-F04 [8086-8C18] [0000-0000] [CC0604]: Intel Lynx Point PCH - PCI Express Root Port 5
B00-D1C-F05 [8086-8C1A] [0000-0000] [CC0604]: Intel Lynx Point PCH - PCI Express Root Port 6
B00-D1D-F00 [8086-8C26] [1558-6557] [CC0C03]: Intel Lynx Point PCH - USB 2.0 EHCI Host Controller 1 [C-2]
B00-D1F-F00 [8086-8C4B] [1558-6557] [CC0601]: Intel HM87 Chipset - LPC Interface Controller [C-2]
B00-D1F-F02 [8086-8C03] [1558-6557] [CC0106]: Intel Lynx Point-M PCH - SATA AHCI Controller (Ports 0-5) [C-2]
B00-D1F-F03 [8086-8C22] [1558-6557] [CC0C05]: Intel Lynx Point PCH - SMBus Controller [C-2]
B00-D1F-F06 [8086-8C24] [1558-6557] [CC1180]: Intel Lynx Point PCH - Thermal Controller [C-2]
B03-D00-F00 [10EC-5287] [10EC-5287] [CCFF00]: Realtek RTS5287 PCI-E Card Reader
B03-D00-F01 [10EC-8168] [1558-6557] [CC0200]: Realtek RTL8168/8111 PCI-E Gigabit Ethernet Adapter
B04-D00-F00 [10EC-B723] [10EC-B733] [CC0280]: Realtek RTL8723BE Wireless LAN 802.11n PCI-E Network Adapter

B00 D00 F00: Intel Haswell-MB - Host Bridge/DRAM Controller

  Offset 000:  86 80 04 0C  06 00 90 20  06 00 00 06  00 00 00 00 
  Offset 010:  00 00 00 00  00 00 00 00  00 00 00 00  00 00 00 00 
  Offset 020:  00 00 00 00  00 00 00 00  00 00 00 00  58 15 57 65 
  Offset 030:  00 00 00 00  E0 00 00 00  00 00 00 00  00 00 00 00 
  Offset 040:  01 90 D1 FE  00 00 00 00  01 00 D1 FE  00 00 00 00 
  Offset 050:  11 02 00 00  39 00 00 00  17 00 10 CF  01 00 00 CA 
  Offset 060:  05 00 00 F8  00 00 00 00  01 80 D1 FE  00 00 00 00 
  Offset 070:  00 00 00 FF  01 00 00 00  00 0C 00 FF  7F 00 00 00 
  Offset 080:  10 11 11 00  00 11 11 00  1A 00 00 00  00 00 00 00 
  Offset 090:  01 00 00 FF  01 00 00 00  01 00 D0 2F  02 00 00 00 
  Offset 0A0:  01 00 00 00  02 00 00 00  01 00 E0 2F  02 00 00 00 
  Offset 0B0:  01 00 20 CB  01 00 00 CB  01 00 00 CA  01 00 20 CF 
  Offset 0C0:  00 00 00 00  00 00 00 00  00 00 00 00  00 00 00 00 
  Offset 0D0:  00 00 00 00  00 00 00 00  00 00 00 00  00 00 00 00 
  Offset 0E0:  09 00 0C 01  69 21 00 62  D0 00 4C 74  00 00 00 00 
  Offset 0F0:  00 00 00 00  C8 0F 03 00  00 00 00 00  00 00 00 00 

B00 D01 F00: Intel Haswell - PCI Express x16 Controller

  Offset 000:  86 80 01 0C  00 04 10 00  06 00 04 06  10 00 81 00 
  Offset 010:  00 00 00 00  00 00 00 00  00 01 01 00  E0 E0 00 00 
  Offset 020:  00 F6 00 F7  01 E0 F1 F1  00 00 00 00  00 00 00 00 
  Offset 030:  00 00 00 00  88 00 00 00  00 00 00 00  0B 01 00 00 
  Offset 040:  00 00 00 00  00 00 00 00  00 00 00 00  00 00 00 00 
  Offset 050:  00 00 00 00  00 00 00 00  00 00 00 00  00 00 00 00 
  Offset 060:  00 00 00 00  00 00 00 00  00 00 00 00  00 00 00 00 
  Offset 070:  00 00 00 00  00 00 00 00  00 00 00 00  00 00 00 0A 
  Offset 080:  01 90 03 C8  0B 00 00 00  0D 80 00 00  58 15 57 65 
  Offset 090:  05 A0 00 00  00 00 00 00  00 00 00 00  00 00 00 00 
  Offset 0A0:  10 00 42 01  01 80 00 00  20 00 00 00  03 AD 61 02 
  Offset 0B0:  50 00 01 91  00 00 0C 00  00 00 48 00  00 00 00 00 
  Offset 0C0:  00 00 00 00  80 0B 08 00  00 00 00 00  0E 00 00 00 
  Offset 0D0:  43 00 1E 00  00 00 00 00  00 00 00 00  00 00 00 00 
  Offset 0E0:  00 00 00 00  00 00 00 00  00 00 00 00  00 00 00 00 
  Offset 0F0:  00 00 01 FC  4E 01 01 40  00 00 00 00  00 00 10 00 

B00 D02 F00: Intel Haswell-MB GT2 - Integrated Graphics Controller

  Offset 000:  86 80 16 04  07 04 90 00  06 00 00 03  00 00 00 00 
  Offset 010:  04 00 40 F7  00 00 00 00  0C 00 00 D0  00 00 00 00 
  Offset 020:  01 F0 00 00  00 00 00 00  00 00 00 00  58 15 57 65 
  Offset 030:  00 00 00 00  90 00 00 00  00 00 00 00  00 01 00 00 
  Offset 040:  09 00 0C 01  69 21 00 62  D0 00 4C 74  00 00 00 00 
  Offset 050:  11 02 00 00  39 00 00 00  00 00 00 00  01 00 20 CB 
  Offset 060:  00 00 02 00  00 00 00 00  00 00 00 00  00 00 00 00 
  Offset 070:  00 00 00 00  00 00 00 00  00 00 00 00  00 00 00 00 
  Offset 080:  00 00 00 00  00 00 00 00  00 00 00 00  00 00 00 00 
  Offset 090:  05 D0 01 00  D8 01 E0 FE  00 00 00 00  00 00 00 00 
  Offset 0A0:  00 00 00 00  13 00 06 03  00 00 00 00  00 00 00 00 
  Offset 0B0:  00 00 00 00  00 00 00 00  00 00 00 00  00 00 00 00 
  Offset 0C0:  00 00 00 00  00 00 00 00  00 00 00 00  00 00 00 00 
  Offset 0D0:  01 A4 22 00  00 00 00 00  00 00 00 00  00 00 00 00 
  Offset 0E0:  00 00 00 00  00 00 00 00  00 80 00 00  00 00 00 00 
  Offset 0F0:  00 00 00 00  00 00 00 00  00 00 06 00  18 F0 78 C9 

B00 D03 F00: Intel Haswell - Mini HD Audio Controller

  Offset 000:  86 80 0C 0C  06 00 10 00  06 00 03 04  10 00 00 00 
  Offset 010:  04 C0 AF FE  00 00 00 00  00 00 00 00  00 00 00 00 
  Offset 020:  00 00 00 00  00 00 00 00  00 00 00 00  58 15 57 65 
  Offset 030:  00 00 00 00  50 00 00 00  00 00 00 00  10 01 00 00 
  Offset 040:  00 00 00 00  69 21 00 62  D0 00 4C 74  39 00 00 00 
  Offset 050:  01 60 02 00  00 00 00 00  00 00 00 00  00 00 00 00 
  Offset 060:  05 70 00 00  00 00 00 00  00 00 00 00  00 00 00 00 
  Offset 070:  10 00 91 00  C0 0F 00 10  00 08 00 00  00 00 00 00 
  Offset 080:  00 00 00 00  00 00 00 00  00 00 00 00  00 00 00 00 
  Offset 090:  00 00 00 00  00 00 00 00  00 00 00 00  00 00 00 00 
  Offset 0A0:  00 00 00 00  00 00 00 00  00 00 00 00  00 00 00 00 
  Offset 0B0:  00 00 00 00  00 00 00 00  00 00 00 00  00 00 00 00 
  Offset 0C0:  00 00 00 00  00 00 00 00  00 00 00 00  00 00 00 00 
  Offset 0D0:  00 00 00 00  00 00 00 00  00 00 00 00  00 00 00 00 
  Offset 0E0:  00 00 00 00  00 00 00 00  00 00 00 00  00 00 00 00 
  Offset 0F0:  00 00 00 00  00 00 00 00  00 00 00 00  00 00 00 00 

B00 D14 F00: Intel Lynx Point PCH - USB 3.0 xHCI Host Controller [C-2]

  Offset 000:  86 80 31 8C  06 04 90 02  05 30 03 0C  00 00 00 00 
  Offset 010:  04 00 A0 F7  00 00 00 00  00 00 00 00  00 00 00 00 
  Offset 020:  00 00 00 00  00 00 00 00  00 00 00 00  58 15 57 65 
  Offset 030:  00 00 00 00  70 00 00 00  00 00 00 00  00 01 00 00 
  Offset 040:  FD 01 06 80  89 C6 0F 80  00 00 00 00  00 00 00 00 
  Offset 050:  9F 6E 88 07  00 00 00 00  00 00 00 00  00 00 00 00 
  Offset 060:  30 20 00 00  00 00 00 00  00 00 00 00  00 00 00 00 
  Offset 070:  01 80 C2 C1  08 00 00 00  00 00 00 00  00 00 00 00 
  Offset 080:  05 00 87 00  18 02 E0 FE  00 00 00 00  00 00 00 00 
  Offset 090:  00 00 00 00  00 00 00 00  00 00 00 00  00 00 00 00 
  Offset 0A0:  40 01 00 00  00 00 00 00  00 00 00 00  00 00 00 00 
  Offset 0B0:  0F 00 01 00  00 00 00 00  00 00 00 00  00 00 00 00 
  Offset 0C0:  03 04 20 C0  03 0C 30 00  03 0C 30 00  00 00 00 00 
  Offset 0D0:  FF 3F 00 00  FF 3F 00 00  3F 00 00 00  3F 00 00 00 
  Offset 0E0:  A0 00 00 00  00 10 00 00  00 00 00 00  D8 D8 D8 08 
  Offset 0F0:  00 00 00 00  00 00 00 00  B1 0F 06 08  00 00 00 00 

B00 D16 F00: Intel Lynx Point PCH - Host Embedded Controller Interface 1 (HECI1) [C-1]

  Offset 000:  86 80 3A 8C  06 00 10 00  04 00 80 07  00 00 80 00 
  Offset 010:  04 E0 A1 F7  00 00 00 00  00 00 00 00  00 00 00 00 
  Offset 020:  00 00 00 00  00 00 00 00  00 00 00 00  58 15 57 65 
  Offset 030:  00 00 00 00  50 00 00 00  00 00 00 00  0B 01 00 00 
  Offset 040:  45 02 00 1E  10 00 01 80  06 23 00 60  F0 1F 00 10 
  Offset 050:  01 8C 03 C8  08 00 00 00  00 00 00 00  00 00 00 00 
  Offset 060:  00 02 00 00  00 40 00 00  00 00 00 00  20 00 00 30 
  Offset 070:  00 00 00 00  00 00 00 00  00 00 00 00  00 00 00 00 
  Offset 080:  00 00 00 00  00 00 00 00  00 00 00 00  05 00 80 00 
  Offset 090:  00 00 00 00  00 00 00 00  00 00 00 00  00 00 00 00 
  Offset 0A0:  00 00 00 00  00 00 00 00  00 00 00 00  00 00 00 00 
  Offset 0B0:  00 00 00 00  00 00 00 00  00 00 00 00  02 00 00 C0 
  Offset 0C0:  1C 12 4B AC  CE 88 0E 6B  A9 61 4C 75  16 94 7B 25 
  Offset 0D0:  30 69 1D 55  1E 13 47 CB  ED E0 03 A7  A3 8E D4 1D 
  Offset 0E0:  00 00 00 00  00 00 00 00  00 00 00 00  00 00 00 00 
  Offset 0F0:  00 00 00 00  00 00 00 00  00 00 00 00  00 00 00 00 

B00 D1A F00: Intel Lynx Point PCH - USB 2.0 EHCI Host Controller 2 [C-2]

  Offset 000:  86 80 2D 8C  06 00 90 02  05 20 03 0C  00 00 00 00 
  Offset 010:  00 C0 A1 F7  00 00 00 00  00 00 00 00  00 00 00 00 
  Offset 020:  00 00 00 00  00 00 00 00  00 00 00 00  58 15 57 65 
  Offset 030:  00 00 00 00  50 00 00 00  00 00 00 00  10 01 00 00 
  Offset 040:  00 00 00 00  DB 05 FD 0E  00 00 00 00  00 00 00 00 
  Offset 050:  01 58 C2 C9  00 00 00 00  0A 98 A0 20  00 00 00 00 
  Offset 060:  20 20 81 07  00 00 00 00  01 00 00 00  00 20 00 C0 
  Offset 070:  00 00 DF 3F  03 0C 30 00  4F 01 00 00  8C 40 00 00 
  Offset 080:  00 00 80 00  11 88 0C 93  70 0D 00 24  01 04 02 00 
  Offset 090:  00 00 00 00  00 00 00 00  13 00 06 03  00 00 00 00 
  Offset 0A0:  00 00 00 00  00 00 00 00  00 00 00 00  00 00 00 00 
  Offset 0B0:  00 00 00 00  00 00 00 00  00 00 00 00  00 00 00 00 
  Offset 0C0:  00 00 00 00  00 00 00 00  00 00 00 00  00 00 00 00 
  Offset 0D0:  00 00 00 00  00 AA FF 00  00 00 FF FF  27 00 00 00 
  Offset 0E0:  00 00 00 00  FF FF FF FF  FE FF 7F FF  84 00 51 C7 
  Offset 0F0:  00 00 00 00  88 85 80 00  B1 0F 06 08  08 17 1A 20 

B00 D1B F00: Intel Lynx Point PCH - High Definition Audio Controller [C-2]

  Offset 000:  86 80 20 8C  06 00 10 00  05 00 03 04  10 00 00 00 
  Offset 010:  04 80 AF FE  00 00 00 00  00 00 00 00  00 00 00 00 
  Offset 020:  00 00 00 00  00 00 00 00  00 00 00 00  58 15 57 65 
  Offset 030:  00 00 00 00  50 00 00 00  00 00 00 00  16 01 00 00 
  Offset 040:  03 00 00 17  00 00 00 00  00 00 00 00  00 00 00 00 
  Offset 050:  01 60 42 C8  00 00 00 00  00 00 00 00  00 00 00 00 
  Offset 060:  05 70 80 00  00 00 00 00  00 00 00 00  00 00 00 00 
  Offset 070:  10 00 91 00  00 00 00 10  00 08 10 00  00 00 00 00 
  Offset 080:  00 00 00 00  00 00 00 00  00 00 00 00  00 00 00 00 
  Offset 090:  00 00 00 00  00 00 00 00  00 00 00 00  00 00 00 00 
  Offset 0A0:  00 00 00 00  00 00 00 00  00 00 00 00  00 00 00 00 
  Offset 0B0:  00 00 00 00  00 00 00 00  00 00 00 00  00 00 00 00 
  Offset 0C0:  00 04 02 01  00 60 00 00  00 0C 85 82  10 00 33 02 
  Offset 0D0:  00 0C 85 02  10 00 33 02  00 00 00 00  00 00 00 00 
  Offset 0E0:  00 00 00 00  00 00 00 00  00 00 00 00  00 00 00 00 
  Offset 0F0:  00 00 00 00  00 00 00 00  B1 0F 06 08  00 00 00 00 

B00 D1C F00: Intel Lynx Point PCH - PCI Express Root Port 1

  Offset 000:  86 80 10 8C  04 04 10 00  D5 00 04 06  10 00 81 00 
  Offset 010:  00 00 00 00  00 00 00 00  00 02 02 00  F0 00 00 20 
  Offset 020:  F0 FF 00 00  F1 FF 01 00  00 00 00 00  00 00 00 00 
  Offset 030:  00 00 00 00  40 00 00 00  00 00 00 00  0B 01 00 00 
  Offset 040:  10 80 42 01  00 80 00 00  00 00 10 00  42 4C 31 01 
  Offset 050:  01 00 01 10  60 00 04 00  00 00 00 00  00 00 00 00 
  Offset 060:  00 00 00 00  17 08 08 00  00 04 00 00  00 00 00 00 
  Offset 070:  02 00 01 00  00 00 00 00  00 00 00 00  00 00 00 00 
  Offset 080:  05 90 00 00  00 00 00 00  00 00 00 00  00 00 00 00 
  Offset 090:  0D A0 00 00  58 15 57 65  00 00 00 00  00 00 00 00 
  Offset 0A0:  01 00 03 C8  00 00 00 00  00 00 00 00  00 00 00 00 
  Offset 0B0:  00 00 00 00  00 00 00 00  00 00 00 00  00 00 00 00 
  Offset 0C0:  00 00 00 00  00 00 00 00  00 00 00 00  00 00 00 00 
  Offset 0D0:  00 00 00 01  02 08 00 00  02 00 11 09  00 00 00 00 
  Offset 0E0:  00 3F 00 00  00 00 00 00  01 00 00 00  00 00 00 00 
  Offset 0F0:  50 00 00 00  80 F5 00 00  B1 0F 06 08  04 E8 05 01 

B00 D1C F04: Intel Lynx Point PCH - PCI Express Root Port 5

  Offset 000:  86 80 18 8C  07 04 10 00  D5 00 04 06  10 00 81 00 
  Offset 010:  00 00 00 00  00 00 00 00  00 03 03 00  D0 D0 00 20 
  Offset 020:  90 F7 90 F7  F1 FF 01 00  00 00 00 00  00 00 00 00 
  Offset 030:  00 00 00 00  40 00 00 00  00 00 00 00  0B 01 00 00 
  Offset 040:  10 80 42 01  00 80 00 00  00 00 10 00  12 3C 32 05 
  Offset 050:  42 00 11 70  00 B2 24 00  00 00 40 00  00 00 00 00 
  Offset 060:  00 00 00 00  17 08 00 00  00 04 00 00  00 00 00 00 
  Offset 070:  02 00 01 00  00 00 00 00  00 00 00 00  00 00 00 00 
  Offset 080:  05 90 00 00  00 00 00 00  00 00 00 00  00 00 00 00 
  Offset 090:  0D A0 00 00  58 15 57 65  00 00 00 00  00 00 00 00 
  Offset 0A0:  01 00 03 C8  00 00 00 00  00 00 00 00  00 00 00 00 
  Offset 0B0:  00 00 00 00  00 00 00 00  00 00 00 00  00 00 00 00 
  Offset 0C0:  00 00 00 00  00 00 00 00  00 00 00 00  00 00 00 00 
  Offset 0D0:  00 00 00 01  42 18 00 00  08 80 11 0B  00 00 00 00 
  Offset 0E0:  00 3F 00 00  03 90 03 90  11 00 00 00  00 00 00 00 
  Offset 0F0:  50 00 00 00  40 00 00 00  B1 0F 06 08  04 28 00 05 

B00 D1C F05: Intel Lynx Point PCH - PCI Express Root Port 6

  Offset 000:  86 80 1A 8C  07 04 10 00  D5 00 04 06  10 00 81 00 
  Offset 010:  00 00 00 00  00 00 00 00  00 04 04 00  C0 C0 00 00 
  Offset 020:  80 F7 80 F7  F1 FF 01 00  00 00 00 00  00 00 00 00 
  Offset 030:  00 00 00 00  40 00 00 00  00 00 00 00  03 02 00 00 
  Offset 040:  10 80 42 01  00 80 00 00  00 00 10 00  12 3C 32 06 
  Offset 050:  42 00 11 70  00 B2 2C 00  00 00 40 00  00 00 00 00 
  Offset 060:  00 00 00 00  17 08 00 00  00 04 00 00  00 00 00 00 
  Offset 070:  02 00 01 00  00 00 00 00  00 00 00 00  00 00 00 00 
  Offset 080:  05 90 00 00  00 00 00 00  00 00 00 00  00 00 00 00 
  Offset 090:  0D A0 00 00  58 15 57 65  00 00 00 00  00 00 00 00 
  Offset 0A0:  01 00 03 C8  00 00 00 00  00 00 00 00  00 00 00 00 
  Offset 0B0:  00 00 00 00  00 00 00 00  00 00 00 00  00 00 00 00 
  Offset 0C0:  00 00 00 00  00 00 00 00  00 00 00 00  00 00 00 00 
  Offset 0D0:  00 00 00 01  42 18 00 00  08 80 11 8B  00 00 00 00 
  Offset 0E0:  00 03 00 00  00 00 00 00  11 00 00 00  00 00 00 00 
  Offset 0F0:  50 00 00 00  40 00 00 0C  B1 0F 06 08  04 28 00 06 

B00 D1D F00: Intel Lynx Point PCH - USB 2.0 EHCI Host Controller 1 [C-2]

  Offset 000:  86 80 26 8C  06 00 90 02  05 20 03 0C  00 00 00 00 
  Offset 010:  00 B0 A1 F7  00 00 00 00  00 00 00 00  00 00 00 00 
  Offset 020:  00 00 00 00  00 00 00 00  00 00 00 00  58 15 57 65 
  Offset 030:  00 00 00 00  50 00 00 00  00 00 00 00  17 01 00 00 
  Offset 040:  00 00 00 00  DB 05 15 37  00 00 00 00  00 00 00 00 
  Offset 050:  01 58 C2 C9  00 00 00 00  0A 98 A0 20  00 00 00 00 
  Offset 060:  20 20 01 06  40 00 00 00  01 00 00 00  00 20 00 C0 
  Offset 070:  00 00 DF 3F  03 04 20 C0  4F 01 00 00  8C 40 00 00 
  Offset 080:  00 00 80 00  11 88 0C 93  70 0D 00 24  01 04 02 00 
  Offset 090:  00 00 00 00  00 00 00 00  13 00 06 03  00 00 00 00 
  Offset 0A0:  00 00 00 00  00 00 00 00  00 00 00 00  00 00 00 00 
  Offset 0B0:  00 00 00 00  00 00 00 00  00 00 00 00  00 00 00 00 
  Offset 0C0:  00 00 00 00  00 00 00 00  00 00 00 00  00 00 00 00 
  Offset 0D0:  00 00 00 00  00 AA FF 00  00 00 75 6D  27 00 00 00 
  Offset 0E0:  00 00 00 00  FF FF FF FF  FF FF FF FF  04 E0 B5 C8 
  Offset 0F0:  00 00 00 00  88 85 80 00  B1 0F 06 08  08 17 1A 20 

B00 D1F F00: Intel HM87 Chipset - LPC Interface Controller [C-2]

  Offset 000:  86 80 4B 8C  07 00 10 02  05 00 01 06  00 00 80 00 
  Offset 010:  00 00 00 00  00 00 00 00  00 00 00 00  00 00 00 00 
  Offset 020:  00 00 00 00  00 00 00 00  00 00 00 00  58 15 57 65 
  Offset 030:  00 00 00 00  E0 00 00 00  00 00 00 00  00 00 00 00 
  Offset 040:  01 18 00 00  80 00 00 00  01 1C 00 00  10 00 00 00 
  Offset 050:  F8 00 00 00  00 00 00 00  00 00 00 00  00 00 00 00 
  Offset 060:  8B 83 8B 8A  D0 00 00 00  80 80 85 84  F8 F0 00 00 
  Offset 070:  78 F0 78 F0  78 F0 78 F0  78 F0 78 F0  78 F0 78 F0 
  Offset 080:  00 00 00 3C  69 00 0C 00  21 33 0C 00  00 00 00 00 
  Offset 090:  00 00 00 00  00 0F 00 00  01 00 70 FF  00 00 00 00 
  Offset 0A0:  10 5E 80 60  09 18 06 00  00 46 00 00  00 00 01 80 
  Offset 0B0:  00 00 00 00  00 00 00 00  00 80 00 00  00 00 00 00 
  Offset 0C0:  00 00 00 00  00 00 00 00  00 00 00 00  00 00 00 00 
  Offset 0D0:  33 22 11 00  67 45 00 00  C7 FF 00 00  08 00 00 00 
  Offset 0E0:  09 00 0C 10  00 00 00 00  01 E8 30 95  00 00 00 00 
  Offset 0F0:  01 C0 D1 FE  00 00 00 00  B1 0F 06 08  00 00 00 00 

B00 D1F F02: Intel Lynx Point-M PCH - SATA AHCI Controller (Ports 0-5) [C-2]

  Offset 000:  86 80 03 8C  07 04 B0 02  05 01 06 01  00 00 00 00 
  Offset 010:  B1 F0 00 00  A1 F0 00 00  91 F0 00 00  81 F0 00 00 
  Offset 020:  61 F0 00 00  00 A0 A1 F7  00 00 00 00  58 15 57 65 
  Offset 030:  00 00 00 00  80 00 00 00  00 00 00 00  00 02 00 00 
  Offset 040:  00 80 00 80  00 00 00 00  00 00 00 00  00 00 00 00 
  Offset 050:  00 00 00 00  00 00 00 00  00 00 00 00  00 00 00 00 
  Offset 060:  00 00 00 00  00 00 00 00  00 00 00 00  00 00 00 00 
  Offset 070:  01 A8 03 40  08 00 00 00  00 00 00 00  00 00 00 00 
  Offset 080:  05 70 01 00  18 01 E0 FE  00 00 00 00  00 00 00 00 
  Offset 090:  60 3A 05 81  83 01 00 3A  20 02 5C 20  20 00 00 80 
  Offset 0A0:  A8 00 00 00  00 00 00 00  12 00 10 00  48 00 00 00 
  Offset 0B0:  00 00 00 00  00 00 00 00  00 00 00 00  00 00 00 00 
  Offset 0C0:  00 00 00 00  00 00 00 00  00 00 00 00  00 00 00 00 
  Offset 0D0:  00 00 00 00  00 00 00 00  00 00 00 00  00 00 00 00 
  Offset 0E0:  00 00 00 00  00 00 00 00  00 00 00 00  00 00 00 00 
  Offset 0F0:  00 00 00 00  00 00 00 00  B1 0F 06 08  00 00 00 00 

B00 D1F F03: Intel Lynx Point PCH - SMBus Controller [C-2]

  Offset 000:  86 80 22 8C  03 00 80 02  05 00 05 0C  00 00 00 00 
  Offset 010:  04 90 A1 F7  00 00 00 00  00 00 00 00  00 00 00 00 
  Offset 020:  41 F0 00 00  00 00 00 00  00 00 00 00  58 15 57 65 
  Offset 030:  00 00 00 00  00 00 00 00  00 00 00 00  0B 03 00 00 
  Offset 040:  11 00 00 00  00 00 00 00  00 00 00 00  00 00 00 00 
  Offset 050:  00 00 00 00  00 00 00 00  00 00 00 00  00 00 00 00 
  Offset 060:  03 04 04 00  00 00 08 08  00 00 00 00  00 00 00 00 
  Offset 070:  00 00 00 00  00 00 00 00  00 00 00 00  00 00 00 00 
  Offset 080:  04 00 00 00  00 00 00 00  00 00 00 00  00 00 00 00 
  Offset 090:  00 00 00 00  00 00 00 00  00 00 00 00  00 00 00 00 
  Offset 0A0:  00 00 00 00  00 00 00 00  00 00 00 00  00 00 00 00 
  Offset 0B0:  00 00 00 00  00 00 00 00  00 00 00 00  00 00 00 00 
  Offset 0C0:  00 00 00 00  00 00 00 00  00 00 00 00  00 00 00 00 
  Offset 0D0:  00 00 00 00  00 00 00 00  00 00 00 00  00 00 00 00 
  Offset 0E0:  00 00 00 00  00 00 00 00  00 00 00 00  00 00 00 00 
  Offset 0F0:  00 00 00 00  00 00 00 00  B1 0F 06 08  00 00 00 00 

B00 D1F F06: Intel Lynx Point PCH - Thermal Controller [C-2]

  Offset 000:  86 80 24 8C  00 00 10 00  05 00 80 11  00 00 00 00 
  Offset 010:  04 00 00 00  00 00 00 00  00 00 00 00  00 00 00 00 
  Offset 020:  00 00 00 00  00 00 00 00  00 00 00 00  58 15 57 65 
  Offset 030:  00 00 00 00  50 00 00 00  00 00 00 00  0B 03 00 00 
  Offset 040:  05 E0 FE F7  00 00 00 00  00 00 00 00  00 00 00 00 
  Offset 050:  01 80 23 00  08 00 00 00  00 00 00 00  00 00 00 00 
  Offset 060:  00 00 00 00  00 00 00 00  00 00 00 00  00 00 00 00 
  Offset 070:  00 00 00 00  00 00 00 00  00 00 00 00  00 00 00 00 
  Offset 080:  05 00 00 00  00 00 00 00  00 00 00 00  00 00 00 00 
  Offset 090:  00 00 00 00  00 00 00 00  00 00 00 00  00 00 00 00 
  Offset 0A0:  00 00 00 00  00 00 00 00  00 00 00 00  00 00 00 00 
  Offset 0B0:  00 00 00 00  00 00 00 00  00 00 00 00  00 00 00 00 
  Offset 0C0:  00 00 00 00  00 00 00 00  00 00 00 00  00 00 00 00 
  Offset 0D0:  00 00 00 00  00 00 00 00  00 00 00 00  00 00 00 00 
  Offset 0E0:  00 00 00 00  00 00 00 00  00 00 00 00  00 00 00 00 
  Offset 0F0:  00 00 00 00  00 00 00 00  B1 0F 06 08  00 00 00 00 

B03 D00 F00: Realtek RTS5287 PCI-E Card Reader

  Offset 000:  EC 10 87 52  06 04 10 00  01 00 00 FF  10 00 80 00 
  Offset 010:  00 50 91 F7  00 00 00 00  00 00 00 00  00 00 00 00 
  Offset 020:  00 00 00 00  00 00 00 00  00 00 00 00  EC 10 87 52 
  Offset 030:  00 00 00 00  40 00 00 00  00 00 00 00  00 02 00 00 
  Offset 040:  01 50 C3 F7  00 00 00 00  00 00 00 00  00 00 00 00 
  Offset 050:  05 70 81 00  F8 01 E0 FE  00 00 00 00  00 00 00 00 
  Offset 060:  00 00 00 00  00 00 00 00  00 00 00 00  00 00 00 00 
  Offset 070:  10 B0 02 00  C0 8C 90 05  00 20 19 00  11 7C 47 00 
  Offset 080:  42 01 11 10  00 00 00 00  00 00 00 00  00 00 00 00 
  Offset 090:  00 00 00 00  1F 08 0C 00  00 04 00 00  02 00 00 00 
  Offset 0A0:  00 00 00 00  00 00 00 00  00 00 00 00  00 00 00 00 
  Offset 0B0:  11 D0 00 00  00 00 00 00  00 00 00 00  00 00 00 00 
  Offset 0C0:  00 00 00 00  00 00 00 00  00 00 00 00  00 00 00 00 
  Offset 0D0:  03 00 00 00  00 00 00 00  00 00 00 00  00 00 00 00 
  Offset 0E0:  00 00 00 00  00 00 00 00  00 00 00 00  00 00 00 00 
  Offset 0F0:  00 00 00 00  00 00 00 00  00 00 00 00  00 00 00 00 

B03 D00 F01: Realtek RTL8168/8111 PCI-E Gigabit Ethernet Adapter

  Offset 000:  EC 10 68 81  07 04 10 00  12 00 00 02  10 00 80 00 
  Offset 010:  01 D0 00 00  00 00 00 00  04 40 91 F7  00 00 00 00 
  Offset 020:  04 00 91 F7  00 00 00 00  00 00 00 00  58 15 57 65 
  Offset 030:  00 00 00 00  40 00 00 00  00 00 00 00  00 01 00 00 
  Offset 040:  01 50 C3 FF  08 00 00 00  00 00 00 00  00 00 00 00 
  Offset 050:  05 70 80 00  00 00 00 00  00 00 00 00  00 00 00 00 
  Offset 060:  00 00 00 00  00 00 00 00  00 00 00 00  00 00 00 00 
  Offset 070:  10 B0 02 02  C0 8C 90 05  00 50 19 00  11 7C 47 00 
  Offset 080:  40 00 11 10  00 00 00 00  00 00 00 00  00 00 00 00 
  Offset 090:  00 00 00 00  1F 08 0C 00  10 00 00 00  02 00 00 00 
  Offset 0A0:  00 00 00 00  00 00 00 00  00 00 00 00  00 00 00 00 
  Offset 0B0:  11 D0 03 80  04 00 00 00  04 08 00 00  00 00 00 00 
  Offset 0C0:  00 00 00 00  00 00 00 00  00 00 00 00  00 00 00 00 
  Offset 0D0:  03 00 00 00  00 00 00 00  00 00 00 00  00 00 00 00 
  Offset 0E0:  00 00 00 00  00 00 00 00  00 00 00 00  00 00 00 00 
  Offset 0F0:  00 00 00 00  00 00 00 00  00 00 00 00  00 00 00 00 

B03 D00 F01: [VPD] Realtek RTL8168/8111 PCI-E Gigabit Ethernet Adapter

  Offset 000:  00 00 00 00  00 00 00 00  00 00 00 00  00 00 00 00   ................
  Offset 010:  00 00 00 00  00 00 00 00  00 00 00 00  00 00 00 00   ................
  Offset 020:  00 00 00 00  00 00 00 00  00 00 00 00  00 00 00 00   ................
  Offset 030:  00 00 00 00  00 00 00 00  00 00 00 00  00 00 00 00   ................
  Offset 040:  00 00 00 00  00 00 00 00  00 00 00 00  00 00 00 00   ................
  Offset 050:  00 00 00 00  00 00 00 00  00 00 00 00  00 00 00 00   ................
  Offset 060:  00 00 00 00  00 00 00 00  00 00 00 00  00 00 00 00   ................
  Offset 070:  00 00 00 00  00 00 00 00  00 00 00 00  00 00 00 00   ................
  Offset 080:  00 00 00 00  00 00 00 00  00 00 00 00  00 00 00 00   ................
  Offset 090:  00 00 00 00  00 00 00 00  00 00 00 00  00 00 00 00   ................
  Offset 0A0:  00 00 00 00  00 00 00 00  00 00 00 00  00 00 00 00   ................
  Offset 0B0:  00 00 00 00  00 00 00 00  00 00 00 00  00 00 00 00   ................
  Offset 0C0:  00 00 00 00  00 00 00 00  00 00 00 00  00 00 00 00   ................
  Offset 0D0:  00 00 00 00  00 00 00 00  00 00 00 00  00 00 00 00   ................
  Offset 0E0:  00 00 00 00  00 00 00 00  00 00 00 00  00 00 00 00   ................
  Offset 0F0:  00 00 00 00  00 00 00 00  00 00 00 00  00 00 00 00   ................

B04 D00 F00: Realtek RTL8723BE Wireless LAN 802.11n PCI-E Network Adapter

  Offset 000:  EC 10 23 B7  07 04 10 00  00 00 80 02  10 00 00 00 
  Offset 010:  01 CF 00 00  00 00 00 00  04 C0 8F F7  00 00 00 00 
  Offset 020:  00 00 00 00  00 00 00 00  00 00 00 00  EC 10 33 B7 
  Offset 030:  00 00 00 00  40 00 00 00  00 00 00 00  00 01 00 00 
  Offset 040:  01 50 C3 FF  08 00 00 00  00 00 00 00  00 00 00 00 
  Offset 050:  05 70 81 00  78 02 E0 FE  00 00 00 00  00 00 00 00 
  Offset 060:  00 00 00 00  00 00 00 00  00 00 00 00  00 00 00 00 
  Offset 070:  10 00 02 00  80 8D 90 05  00 50 10 00  11 3C 07 00 
  Offset 080:  42 01 11 10  00 00 00 00  00 00 00 00  00 00 00 00 
  Offset 090:  00 00 00 00  10 08 0C 00  10 04 00 00  02 00 00 00 
  Offset 0A0:  00 00 00 00  00 00 00 00  00 00 00 00  00 00 00 00 
  Offset 0B0:  00 00 00 00  00 00 00 00  00 00 00 00  00 00 00 00 
  Offset 0C0:  00 00 00 00  00 00 00 00  00 00 00 00  00 00 00 00 
  Offset 0D0:  00 00 00 00  00 00 00 00  00 00 00 00  00 00 00 00 
  Offset 0E0:  00 00 00 00  00 00 00 00  00 00 00 00  00 00 00 00 
  Offset 0F0:  00 00 00 00  00 00 00 00  00 00 00 00  00 00 00 00 

